{
  "added": "2025-03-15T14:30:00Z",
  "externalDocs": {},
  "info": {},
  "link": "https://api.apis.guru/v2/specs/example/1.0.0/openapi.json",
  "openapiVer": "example-value",
  "swaggerUrl": "https://api.apis.guru/v2/specs/example/1.0.0/openapi.json",
  "swaggerYamlUrl": "https://api.apis.guru/v2/specs/example/1.0.0/openapi.json",
  "updated": "2025-03-15T14:30:00Z"
}